### ISSUE TITLE
Windows XP can not log in.

### ISSUE THREAD

**Issue by pesa1234** [cifsd-team/ksmbd#546]
Dear, do you have any suggestion to use ksmbd with windows xp client?

I enable SMB1.
Windows XP users get the form to insert user and password but they con not log in.
Or if I try to map network drive it does ask me for a password, but then it fails to authenticate and asks again.

Thanks again

**Comment by namjaejeon** [comment]
I checked the connection with windows XP a long time ago. I don't even have windows XP currently for testing. Why are you testing windows XP, which people rarely use?

**Comment by pesa1234** [comment]
I know that is rarely used, but some industrial machine still have XP and if I would like to have connectivity ksmbd can not be used on my router.
I know that Samba 4 is a solution, but it need a lot of resources....

**Comment by namjaejeon** [comment]
Okay, I'm not sure whether I can fix this issue without windows XP. Can you give me tcpdump(or wireshark dump) file that capture packet on problem situation ?

**Comment by pesa1234** [comment]
Hi...
I run this on router... 
` tcpdump -i any -evn tcp port 445`

> 13:36:18.023172  In 0a:00:27:00:00:0d ethertype IPv4 (0x0800), length 68: (tos 0x0, ttl 128, id 2924, offset 0, flags [DF], proto TCP (6), length 52)
    192.168.56.1.50655 > 192.168.56.2.445: Flags [S], cksum 0xb253 (correct), seq 2268627362, win 64240, options [mss 1460,nop,wscale 8,nop,nop,sackOK], length 0
13:36:18.023175  In 0a:00:27:00:00:0d ethertype IPv4 (0x0800), length 68: (tos 0x0, ttl 128, id 2924, offset 0, flags [DF], proto TCP (6), length 52)
    192.168.56.1.50655 > 192.168.56.2.445: Flags [S], cksum 0xb253 (correct), seq 2268627362, win 64240, options [mss 1460,nop,wscale 8,nop,nop,sackOK], length 0
13:36:18.023205 Out 08:00:27:78:52:0b ethertype IPv4 (0x0800), length 68: (tos 0x0, ttl 64, id 0, offset 0, flags [DF], proto TCP (6), length 52)
    192.168.56.2.445 > 192.168.56.1.50655: Flags [S.], cksum 0xf17a (incorrect -> 0x6b61), seq 3848233347, ack 2268627363, win 64240, options [mss 1460,nop,nop,sackOK,nop,wscale 6], length 0
13:36:18.023207 Out 08:00:27:78:52:0b ethertype IPv4 (0x0800), length 68: (tos 0x0, ttl 64, id 0, offset 0, flags [DF], proto TCP (6), length 52)
    192.168.56.2.445 > 192.168.56.1.50655: Flags [S.], cksum 0xf17a (incorrect -> 0x6b61), seq 3848233347, ack 2268627363, win 64240, options [mss 1460,nop,nop,sackOK,nop,wscale 6], length 0
13:36:18.023468  In 0a:00:27:00:00:0d ethertype IPv4 (0x0800), length 62: (tos 0x0, ttl 128, id 2926, offset 0, flags [DF], proto TCP (6), length 40)
    192.168.56.1.50655 > 192.168.56.2.445: Flags [.], cksum 0x870f (correct), ack 1, win 8212, length 0
13:36:18.023469  In 0a:00:27:00:00:0d ethertype IPv4 (0x0800), length 62: (tos 0x0, ttl 128, id 2926, offset 0, flags [DF], proto TCP (6), length 40)
    192.168.56.1.50655 > 192.168.56.2.445: Flags [.], cksum 0x870f (correct), ack 1, win 8212, length 0
13:36:18.023951  In 0a:00:27:00:00:0d ethertype IPv4 (0x0800), length 193: (tos 0x0, ttl 128, id 2927, offset 0, flags [DF], proto TCP (6), length 177)
    192.168.56.1.50655 > 192.168.56.2.445: Flags [P.], cksum 0xbe47 (correct), seq 1:138, ack 1, win 8212, length 137
13:36:18.023952  In 0a:00:27:00:00:0d ethertype IPv4 (0x0800), length 193: (tos 0x0, ttl 128, id 2927, offset 0, flags [DF], proto TCP (6), length 177)
    192.168.56.1.50655 > 192.168.56.2.445: Flags [P.], cksum 0xbe47 (correct), seq 1:138, ack 1, win 8212, length 137
13:36:18.023960 Out 08:00:27:78:52:0b ethertype IPv4 (0x0800), length 56: (tos 0x0, ttl 64, id 52150, offset 0, flags [DF], proto TCP (6), length 40)
    192.168.56.2.445 > 192.168.56.1.50655: Flags [.], cksum 0xf16e (incorrect -> 0xa2b0), ack 138, win 1002, length 0
13:36:18.023962 Out 08:00:27:78:52:0b ethertype IPv4 (0x0800), length 56: (tos 0x0, ttl 64, id 52150, offset 0, flags [DF], proto TCP (6), length 40)
    192.168.56.2.445 > 192.168.56.1.50655: Flags [.], cksum 0xf16e (incorrect -> 0xa2b0), ack 138, win 1002, length 0
13:36:18.030609 Out 08:00:27:78:52:0b ethertype IPv4 (0x0800), length 219: (tos 0x0, ttl 64, id 52151, offset 0, flags [DF], proto TCP (6), length 203)
    192.168.56.2.445 > 192.168.56.1.50655: Flags [P.], cksum 0xf211 (incorrect -> 0x5b0c), seq 1:164, ack 138, win 1002, length 163
13:36:18.030612 Out 08:00:27:78:52:0b ethertype IPv4 (0x0800), length 219: (tos 0x0, ttl 64, id 52151, offset 0, flags [DF], proto TCP (6), length 203)
    192.168.56.2.445 > 192.168.56.1.50655: Flags [P.], cksum 0xf211 (incorrect -> 0x5b0c), seq 1:164, ack 138, win 1002, length 163
13:36:18.031538  In 0a:00:27:00:00:0d ethertype IPv4 (0x0800), length 296: (tos 0x0, ttl 128, id 2928, offset 0, flags [DF], proto TCP (6), length 280)
    192.168.56.1.50655 > 192.168.56.2.445: Flags [P.], cksum 0xd5ef (correct), seq 138:378, ack 164, win 8211, length 240
13:36:18.031540  In 0a:00:27:00:00:0d ethertype IPv4 (0x0800), length 296: (tos 0x0, ttl 128, id 2928, offset 0, flags [DF], proto TCP (6), length 280)
    192.168.56.1.50655 > 192.168.56.2.445: Flags [P.], cksum 0xd5ef (correct), seq 138:378, ack 164, win 8211, length 240
13:36:18.031554 Out 08:00:27:78:52:0b ethertype IPv4 (0x0800), length 56: (tos 0x0, ttl 64, id 52152, offset 0, flags [DF], proto TCP (6), length 40)
    192.168.56.2.445 > 192.168.56.1.50655: Flags [.], cksum 0xf16e (incorrect -> 0xa11d), ack 378, win 1002, length 0
13:36:18.031555 Out 08:00:27:78:52:0b ethertype IPv4 (0x0800), length 56: (tos 0x0, ttl 64, id 52152, offset 0, flags [DF], proto TCP (6), length 40)
    192.168.56.2.445 > 192.168.56.1.50655: Flags [.], cksum 0xf16e (incorrect -> 0xa11d), ack 378, win 1002, length 0
13:36:18.031604 Out 08:00:27:78:52:0b ethertype IPv4 (0x0800), length 332: (tos 0x0, ttl 64, id 52153, offset 0, flags [DF], proto TCP (6), length 316)
    192.168.56.2.445 > 192.168.56.1.50655: Flags [P.], cksum 0xf282 (incorrect -> 0xae60), seq 164:440, ack 378, win 1002, length 276
13:36:18.031606 Out 08:00:27:78:52:0b ethertype IPv4 (0x0800), length 332: (tos 0x0, ttl 64, id 52153, offset 0, flags [DF], proto TCP (6), length 316)
    192.168.56.2.445 > 192.168.56.1.50655: Flags [P.], cksum 0xf282 (incorrect -> 0xae60), seq 164:440, ack 378, win 1002, length 276
13:36:18.032255  In 0a:00:27:00:00:0d ethertype IPv4 (0x0800), length 406: (tos 0x0, ttl 128, id 2929, offset 0, flags [DF], proto TCP (6), length 390)
    192.168.56.1.50655 > 192.168.56.2.445: Flags [P.], cksum 0xab57 (correct), seq 378:728, ack 440, win 8210, length 350
13:36:18.032256  In 0a:00:27:00:00:0d ethertype IPv4 (0x0800), length 406: (tos 0x0, ttl 128, id 2929, offset 0, flags [DF], proto TCP (6), length 390)
    192.168.56.1.50655 > 192.168.56.2.445: Flags [P.], cksum 0xab57 (correct), seq 378:728, ack 440, win 8210, length 350
13:36:18.032265 Out 08:00:27:78:52:0b ethertype IPv4 (0x0800), length 56: (tos 0x0, ttl 64, id 52154, offset 0, flags [DF], proto TCP (6), length 40)
    192.168.56.2.445 > 192.168.56.1.50655: Flags [.], cksum 0xf16e (incorrect -> 0x9eab), ack 728, win 1002, length 0
13:36:18.032266 Out 08:00:27:78:52:0b ethertype IPv4 (0x0800), length 56: (tos 0x0, ttl 64, id 52154, offset 0, flags [DF], proto TCP (6), length 40)
    192.168.56.2.445 > 192.168.56.1.50655: Flags [.], cksum 0xf16e (incorrect -> 0x9eab), ack 728, win 1002, length 0
13:36:18.032464 Out 08:00:27:78:52:0b ethertype IPv4 (0x0800), length 112: (tos 0x0, ttl 64, id 52155, offset 0, flags [DF], proto TCP (6), length 96)
    192.168.56.2.445 > 192.168.56.1.50655: Flags [P.], cksum 0xf1a6 (incorrect -> 0x9e98), seq 440:496, ack 728, win 1002, length 56
13:36:18.032465 Out 08:00:27:78:52:0b ethertype IPv4 (0x0800), length 112: (tos 0x0, ttl 64, id 52155, offset 0, flags [DF], proto TCP (6), length 96)
    192.168.56.2.445 > 192.168.56.1.50655: Flags [P.], cksum 0xf1a6 (incorrect -> 0x9e98), seq 440:496, ack 728, win 1002, length 56
13:36:18.033100  In 0a:00:27:00:00:0d ethertype IPv4 (0x0800), length 150: (tos 0x0, ttl 128, id 2930, offset 0, flags [DF], proto TCP (6), length 134)
    192.168.56.1.50655 > 192.168.56.2.445: Flags [P.], cksum 0x4e01 (correct), seq 728:822, ack 496, win 8210, length 94
13:36:18.033101  In 0a:00:27:00:00:0d ethertype IPv4 (0x0800), length 150: (tos 0x0, ttl 128, id 2930, offset 0, flags [DF], proto TCP (6), length 134)
    192.168.56.1.50655 > 192.168.56.2.445: Flags [P.], cksum 0x4e01 (correct), seq 728:822, ack 496, win 8210, length 94
13:36:18.033109 Out 08:00:27:78:52:0b ethertype IPv4 (0x0800), length 56: (tos 0x0, ttl 64, id 52156, offset 0, flags [DF], proto TCP (6), length 40)
    192.168.56.2.445 > 192.168.56.1.50655: Flags [.], cksum 0xf16e (incorrect -> 0x9e15), ack 822, win 1002, length 0
13:36:18.033110 Out 08:00:27:78:52:0b ethertype IPv4 (0x0800), length 56: (tos 0x0, ttl 64, id 52156, offset 0, flags [DF], proto TCP (6), length 40)
    192.168.56.2.445 > 192.168.56.1.50655: Flags [.], cksum 0xf16e (incorrect -> 0x9e15), ack 822, win 1002, length 0
13:36:18.033157 Out 08:00:27:78:52:0b ethertype IPv4 (0x0800), length 95: (tos 0x0, ttl 64, id 52157, offset 0, flags [DF], proto TCP (6), length 79)
    192.168.56.2.445 > 192.168.56.1.50655: Flags [P.], cksum 0xf195 (incorrect -> 0x100a), seq 496:535, ack 822, win 1002, length 39
13:36:18.033159 Out 08:00:27:78:52:0b ethertype IPv4 (0x0800), length 95: (tos 0x0, ttl 64, id 52157, offset 0, flags [DF], proto TCP (6), length 79)
    192.168.56.2.445 > 192.168.56.1.50655: Flags [P.], cksum 0xf195 (incorrect -> 0x100a), seq 496:535, ack 822, win 1002, length 39
13:36:18.033738  In 0a:00:27:00:00:0d ethertype IPv4 (0x0800), length 99: (tos 0x0, ttl 128, id 2931, offset 0, flags [DF], proto TCP (6), length 83)
    192.168.56.1.50655 > 192.168.56.2.445: Flags [P.], cksum 0x74f7 (correct), seq 822:865, ack 535, win 8210, length 43
13:36:18.033739  In 0a:00:27:00:00:0d ethertype IPv4 (0x0800), length 99: (tos 0x0, ttl 128, id 2931, offset 0, flags [DF], proto TCP (6), length 83)
    192.168.56.1.50655 > 192.168.56.2.445: Flags [P.], cksum 0x74f7 (correct), seq 822:865, ack 535, win 8210, length 43
13:36:18.033755 Out 08:00:27:78:52:0b ethertype IPv4 (0x0800), length 56: (tos 0x0, ttl 64, id 52158, offset 0, flags [DF], proto TCP (6), length 40)
    192.168.56.2.445 > 192.168.56.1.50655: Flags [.], cksum 0xf16e (incorrect -> 0x9dc3), ack 865, win 1002, length 0
13:36:18.033757 Out 08:00:27:78:52:0b ethertype IPv4 (0x0800), length 56: (tos 0x0, ttl 64, id 52158, offset 0, flags [DF], proto TCP (6), length 40)
    192.168.56.2.445 > 192.168.56.1.50655: Flags [.], cksum 0xf16e (incorrect -> 0x9dc3), ack 865, win 1002, length 0
13:36:18.033867 Out 08:00:27:78:52:0b ethertype IPv4 (0x0800), length 95: (tos 0x0, ttl 64, id 52159, offset 0, flags [DF], proto TCP (6), length 79)
    192.168.56.2.445 > 192.168.56.1.50655: Flags [P.], cksum 0xf195 (incorrect -> 0x7506), seq 535:574, ack 865, win 1002, length 39
13:36:18.033869 Out 08:00:27:78:52:0b ethertype IPv4 (0x0800), length 95: (tos 0x0, ttl 64, id 52159, offset 0, flags [DF], proto TCP (6), length 79)
    192.168.56.2.445 > 192.168.56.1.50655: Flags [P.], cksum 0xf195 (incorrect -> 0x7506), seq 535:574, ack 865, win 1002, length 39
13:36:18.034810  In 0a:00:27:00:00:0d ethertype IPv4 (0x0800), length 296: (tos 0x0, ttl 128, id 2932, offset 0, flags [DF], proto TCP (6), length 280)
    192.168.56.1.50655 > 192.168.56.2.445: Flags [P.], cksum 0x917f (correct), seq 865:1105, ack 574, win 8210, length 240
13:36:18.034811  In 0a:00:27:00:00:0d ethertype IPv4 (0x0800), length 296: (tos 0x0, ttl 128, id 2932, offset 0, flags [DF], proto TCP (6), length 280)
    192.168.56.1.50655 > 192.168.56.2.445: Flags [P.], cksum 0x917f (correct), seq 865:1105, ack 574, win 8210, length 240
13:36:18.034819 Out 08:00:27:78:52:0b ethertype IPv4 (0x0800), length 56: (tos 0x0, ttl 64, id 52160, offset 0, flags [DF], proto TCP (6), length 40)
    192.168.56.2.445 > 192.168.56.1.50655: Flags [.], cksum 0xf16e (incorrect -> 0x9cac), ack 1105, win 1002, length 0
13:36:18.034820 Out 08:00:27:78:52:0b ethertype IPv4 (0x0800), length 56: (tos 0x0, ttl 64, id 52160, offset 0, flags [DF], proto TCP (6), length 40)
    192.168.56.2.445 > 192.168.56.1.50655: Flags [.], cksum 0xf16e (incorrect -> 0x9cac), ack 1105, win 1002, length 0
13:36:18.034931 Out 08:00:27:78:52:0b ethertype IPv4 (0x0800), length 332: (tos 0x0, ttl 64, id 52161, offset 0, flags [DF], proto TCP (6), length 316)
    192.168.56.2.445 > 192.168.56.1.50655: Flags [P.], cksum 0xf282 (incorrect -> 0xa927), seq 574:850, ack 1105, win 1002, length 276
13:36:18.034932 Out 08:00:27:78:52:0b ethertype IPv4 (0x0800), length 332: (tos 0x0, ttl 64, id 52161, offset 0, flags [DF], proto TCP (6), length 316)
    192.168.56.2.445 > 192.168.56.1.50655: Flags [P.], cksum 0xf282 (incorrect -> 0xa927), seq 574:850, ack 1105, win 1002, length 276
13:36:18.035577  In 0a:00:27:00:00:0d ethertype IPv4 (0x0800), length 406: (tos 0x0, ttl 128, id 2933, offset 0, flags [DF], proto TCP (6), length 390)
    192.168.56.1.50655 > 192.168.56.2.445: Flags [P.], cksum 0x29c6 (correct), seq 1105:1455, ack 850, win 8209, length 350
13:36:18.035579  In 0a:00:27:00:00:0d ethertype IPv4 (0x0800), length 406: (tos 0x0, ttl 128, id 2933, offset 0, flags [DF], proto TCP (6), length 390)
    192.168.56.1.50655 > 192.168.56.2.445: Flags [P.], cksum 0x29c6 (correct), seq 1105:1455, ack 850, win 8209, length 350
13:36:18.035588 Out 08:00:27:78:52:0b ethertype IPv4 (0x0800), length 56: (tos 0x0, ttl 64, id 52162, offset 0, flags [DF], proto TCP (6), length 40)
    192.168.56.2.445 > 192.168.56.1.50655: Flags [.], cksum 0xf16e (incorrect -> 0x9a3a), ack 1455, win 1002, length 0
13:36:18.035589 Out 08:00:27:78:52:0b ethertype IPv4 (0x0800), length 56: (tos 0x0, ttl 64, id 52162, offset 0, flags [DF], proto TCP (6), length 40)
    192.168.56.2.445 > 192.168.56.1.50655: Flags [.], cksum 0xf16e (incorrect -> 0x9a3a), ack 1455, win 1002, length 0
13:36:18.035738 Out 08:00:27:78:52:0b ethertype IPv4 (0x0800), length 112: (tos 0x0, ttl 64, id 52163, offset 0, flags [DF], proto TCP (6), length 96)
    192.168.56.2.445 > 192.168.56.1.50655: Flags [P.], cksum 0xf1a6 (incorrect -> 0x5927), seq 850:906, ack 1455, win 1002, length 56
13:36:18.035739 Out 08:00:27:78:52:0b ethertype IPv4 (0x0800), length 112: (tos 0x0, ttl 64, id 52163, offset 0, flags [DF], proto TCP (6), length 96)
    192.168.56.2.445 > 192.168.56.1.50655: Flags [P.], cksum 0xf1a6 (incorrect -> 0x5927), seq 850:906, ack 1455, win 1002, length 56
13:36:18.036332  In 0a:00:27:00:00:0d ethertype IPv4 (0x0800), length 150: (tos 0x0, ttl 128, id 2934, offset 0, flags [DF], proto TCP (6), length 134)
    192.168.56.1.50655 > 192.168.56.2.445: Flags [P.], cksum 0x0892 (correct), seq 1455:1549, ack 906, win 8208, length 94
13:36:18.036333  In 0a:00:27:00:00:0d ethertype IPv4 (0x0800), length 150: (tos 0x0, ttl 128, id 2934, offset 0, flags [DF], proto TCP (6), length 134)
    192.168.56.1.50655 > 192.168.56.2.445: Flags [P.], cksum 0x0892 (correct), seq 1455:1549, ack 906, win 8208, length 94
13:36:18.036341 Out 08:00:27:78:52:0b ethertype IPv4 (0x0800), length 56: (tos 0x0, ttl 64, id 52164, offset 0, flags [DF], proto TCP (6), length 40)
    192.168.56.2.445 > 192.168.56.1.50655: Flags [.], cksum 0xf16e (incorrect -> 0x99a4), ack 1549, win 1002, length 0
13:36:18.036343 Out 08:00:27:78:52:0b ethertype IPv4 (0x0800), length 56: (tos 0x0, ttl 64, id 52164, offset 0, flags [DF], proto TCP (6), length 40)
    192.168.56.2.445 > 192.168.56.1.50655: Flags [.], cksum 0xf16e (incorrect -> 0x99a4), ack 1549, win 1002, length 0
13:36:18.036386 Out 08:00:27:78:52:0b ethertype IPv4 (0x0800), length 95: (tos 0x0, ttl 64, id 52165, offset 0, flags [DF], proto TCP (6), length 79)
    192.168.56.2.445 > 192.168.56.1.50655: Flags [P.], cksum 0xf195 (incorrect -> 0x7971), seq 906:945, ack 1549, win 1002, length 39
13:36:18.036387 Out 08:00:27:78:52:0b ethertype IPv4 (0x0800), length 95: (tos 0x0, ttl 64, id 52165, offset 0, flags [DF], proto TCP (6), length 79)
    192.168.56.2.445 > 192.168.56.1.50655: Flags [P.], cksum 0xf195 (incorrect -> 0x7971), seq 906:945, ack 1549, win 1002, length 39
13:36:18.036998  In 0a:00:27:00:00:0d ethertype IPv4 (0x0800), length 99: (tos 0x0, ttl 128, id 2935, offset 0, flags [DF], proto TCP (6), length 83)
    192.168.56.1.50655 > 192.168.56.2.445: Flags [P.], cksum 0x2f88 (correct), seq 1549:1592, ack 945, win 8208, length 43
13:36:18.036999  In 0a:00:27:00:00:0d ethertype IPv4 (0x0800), length 99: (tos 0x0, ttl 128, id 2935, offset 0, flags [DF], proto TCP (6), length 83)
    192.168.56.1.50655 > 192.168.56.2.445: Flags [P.], cksum 0x2f88 (correct), seq 1549:1592, ack 945, win 8208, length 43
13:36:18.037023 Out 08:00:27:78:52:0b ethertype IPv4 (0x0800), length 56: (tos 0x0, ttl 64, id 52166, offset 0, flags [DF], proto TCP (6), length 40)
    192.168.56.2.445 > 192.168.56.1.50655: Flags [.], cksum 0xf16e (incorrect -> 0x9952), ack 1592, win 1002, length 0
13:36:18.037024 Out 08:00:27:78:52:0b ethertype IPv4 (0x0800), length 56: (tos 0x0, ttl 64, id 52166, offset 0, flags [DF], proto TCP (6), length 40)
    192.168.56.2.445 > 192.168.56.1.50655: Flags [.], cksum 0xf16e (incorrect -> 0x9952), ack 1592, win 1002, length 0
13:36:18.037053 Out 08:00:27:78:52:0b ethertype IPv4 (0x0800), length 95: (tos 0x0, ttl 64, id 52167, offset 0, flags [DF], proto TCP (6), length 79)
    192.168.56.2.445 > 192.168.56.1.50655: Flags [P.], cksum 0xf195 (incorrect -> 0x78dc), seq 945:984, ack 1592, win 1002, length 39
13:36:18.037054 Out 08:00:27:78:52:0b ethertype IPv4 (0x0800), length 95: (tos 0x0, ttl 64, id 52167, offset 0, flags [DF], proto TCP (6), length 79)
    192.168.56.2.445 > 192.168.56.1.50655: Flags [P.], cksum 0xf195 (incorrect -> 0x78dc), seq 945:984, ack 1592, win 1002, length 39
13:36:18.077387  In 0a:00:27:00:00:0d ethertype IPv4 (0x0800), length 62: (tos 0x0, ttl 128, id 2936, offset 0, flags [DF], proto TCP (6), length 40)
    192.168.56.1.50655 > 192.168.56.2.445: Flags [.], cksum 0x7d05 (correct), ack 984, win 8208, length 0
13:36:18.077390  In 0a:00:27:00:00:0d ethertype IPv4 (0x0800), length 62: (tos 0x0, ttl 128, id 2936, offset 0, flags [DF], proto TCP (6), length 40)
    192.168.56.1.50655 > 192.168.56.2.445: Flags [.], cksum 0x7d05 (correct), ack 984, win 8208, length 0
13:36:18.286570  In 0a:00:27:00:00:0d ethertype IPv4 (0x0800), length 62: (tos 0x0, ttl 128, id 2937, offset 0, flags [DF], proto TCP (6), length 40)
    192.168.56.1.50655 > 192.168.56.2.445: Flags [F.], cksum 0x7d04 (correct), seq 1592, ack 984, win 8208, length 0
13:36:18.286572  In 0a:00:27:00:00:0d ethertype IPv4 (0x0800), length 62: (tos 0x0, ttl 128, id 2937, offset 0, flags [DF], proto TCP (6), length 40)
    192.168.56.1.50655 > 192.168.56.2.445: Flags [F.], cksum 0x7d04 (correct), seq 1592, ack 984, win 8208, length 0
13:36:18.286625 Out 08:00:27:78:52:0b ethertype IPv4 (0x0800), length 56: (tos 0x0, ttl 64, id 52168, offset 0, flags [DF], proto TCP (6), length 40)
    192.168.56.2.445 > 192.168.56.1.50655: Flags [F.], cksum 0xf16e (incorrect -> 0x9929), seq 984, ack 1593, win 1002, length 0
13:36:18.286628 Out 08:00:27:78:52:0b ethertype IPv4 (0x0800), length 56: (tos 0x0, ttl 64, id 52168, offset 0, flags [DF], proto TCP (6), length 40)
    192.168.56.2.445 > 192.168.56.1.50655: Flags [F.], cksum 0xf16e (incorrect -> 0x9929), seq 984, ack 1593, win 1002, length 0
13:36:18.286776  In 0a:00:27:00:00:0d ethertype IPv4 (0x0800), length 62: (tos 0x0, ttl 128, id 2938, offset 0, flags [DF], proto TCP (6), length 40)
    192.168.56.1.50655 > 192.168.56.2.445: Flags [.], cksum 0x7d03 (correct), ack 985, win 8208, length 0
13:36:18.286777  In 0a:00:27:00:00:0d ethertype IPv4 (0x0800), length 62: (tos 0x0, ttl 128, id 2938, offset 0, flags [DF], proto TCP (6), length 40)
    192.168.56.1.50655 > 192.168.56.2.445: Flags [.], cksum 0x7d03 (correct), ack 985, win 8208, length 0

here log of 3 attempt [https://pastebin.com/8QT5tFHU](url)

**Comment by namjaejeon** [comment]
can you attached it as file?

**Comment by pesa1234** [comment]
[tcpdump.log](https://github.com/cifsd-team/ksmbd/files/7654077/tcpdump.log)
Done!
Thanks! In any case you need some more info, just ask! Thanks

**Comment by namjaejeon** [comment]
This file is not interpreted by wireshark.
please do command like this. enp5s0 is nic name. you can find it using ifconfig.

sudo tcpdump -i enp5s0 -w dump.pcapng

**Comment by pesa1234** [comment]
Done, please check and let me know.

[dump.zip](https://github.com/cifsd-team/ksmbd/files/7655594/dump.zip)

**Comment by namjaejeon** [comment]
can you show me the your smb.conf (/etc/ksmbd/smb.conf) ?

**Comment by pesa1234** [comment]
Hi

> [global]
	netbios name = VirtualRouter
	server string = Ksmbd on OpenWrt
	workgroup = WORKGROUP
	interfaces = 
	bind interfaces only = yes
	ipc timeout = 20
	deadtime = 15
	map to guest = Bad User
	smb2 max read = 64K
	smb2 max write = 64K
	smb2 max trans = 64K
	cache read buffers = no
	cache trans buffers = no

> ######### Dynamic written config options #########
	server min protocol = NT1
	server signing = disabled

>[sdb1]
	path = /mnt/sdb1
	force user = root
	force group = root
	read only = no
	guest ok = yes

**Comment by namjaejeon** [comment]
Please turn debug print on like the following.

echo smb > /sys/class/ksmbd-control/debug

and share debug print log to me.

**Comment by pesa1234** [comment]
to read? ok cat /sys/class/ksmbd-control/debug?
this is the answer
[smb] auth vfs oplock ipc conn rdma

**Comment by namjaejeon** [comment]
No, want to see this message from ksmbd server.

[ 4648.698867] ksmbd: tree connect request for tree IPC$ treename \\172.30.1.20\IPC$
[ 4648.698932] ksmbd: IPC share path request

**Comment by pesa1234** [comment]
Ok, here... sorry
[smb log.log](https://github.com/cifsd-team/ksmbd/files/7655925/smb.log.log)

**Comment by namjaejeon** [comment]
Can you try to test with this change ?

@@ -8435,9 +8437,9 @@ bool smb1_is_sign_req(struct ksmbd_work *work, unsigned int command)
 {
        struct smb_hdr *rcv_hdr1 = (struct smb_hdr *)work->request_buf;
 
-       if ((rcv_hdr1->Flags2 & SMBFLG2_SECURITY_SIGNATURE) &&
-                       command != SMB_COM_SESSION_SETUP_ANDX)
-               return true;
+//     if ((rcv_hdr1->Flags2 & SMBFLG2_SECURITY_SIGNATURE) &&
+//                     command != SMB_COM_SESSION_SETUP_ANDX)
+//             return true;
        return false;
 }

**Comment by pesa1234** [comment]
I think that I'm not able to compile the package for openwrt, but I will try

**Comment by namjaejeon** [comment]
Or you can disable signing option from your windows XP.

**Comment by namjaejeon** [comment]
I think that SMB1 signing feature doesn't seem to work properly.

**Comment by pesa1234** [comment]
Dear,
you're right, there's something not working on sign with SMB1.
On my XP Embedded sp3 by set this key below to 0

`HKEY_LOCAL_MACHINE\System\CurrentControlSet\Services\LanManWorkstation\Parameters\EnableSecuritySignature`

all is working...

**Comment by namjaejeon** [comment]
Okay. Most of windows and windows XP doesn't enable signing feature by default. So I didn't found it before. But I don't have time and target(windows XP) to fix signing issue. I hope you or someone interested fix it. If you don't like it, you should disable the smb1 signing feature and use ksmbd.

**Comment by pesa1234** [comment]
> Okay. Most of windows and windows XP doesn't enable signing feature by default. So I didn't found it before. But I don't have time and target(windows XP) to fix signing issue. I hope you or someone interested fix it. If you don't like it, you should disable the smb1 signing feature and use ksmbd.

On windows XP is enabled by default.
So, don't worry, I disable it on XP client from my C# code.

**Comment by namjaejeon** [comment]
Cool.

**Comment by pesa1234** [comment]
Hi, compiled with the patch suggested... It doesn't works!

**Comment by namjaejeon** [comment]
okay, windows XP seems to reject unsigned smb response. Can you send me a tcpdump between windows XP and samba ?

**Comment by pesa1234** [comment]
Sorry, I make a mistake! I forgot to share on wireless wan. Sorry! Sorry! Sorry!

`@@ -8435,9 +8437,9 @@ bool smb1_is_sign_req(struct ksmbd_work *work, unsigned int command)
 {
        struct smb_hdr *rcv_hdr1 = (struct smb_hdr *)work->request_buf;
 
-       if ((rcv_hdr1->Flags2 & SMBFLG2_SECURITY_SIGNATURE) &&
-                       command != SMB_COM_SESSION_SETUP_ANDX)
-               return true;
+//     if ((rcv_hdr1->Flags2 & SMBFLG2_SECURITY_SIGNATURE) &&
+//                     command != SMB_COM_SESSION_SETUP_ANDX)
+//             return true;
        return false;
 }`

WORKS OK

**Comment by namjaejeon** [comment]
okay, it is workaround solution. I can not apply this change to mainline. I would like to check if there is the way that ksmbd send information that ksmbd doesn't support signing feature to client. So want to see patckets from samba. Can you do that ?

**Comment by pesa1234** [comment]
Yes, tcpdump on samba36 is ok? I'll do it on Friday when I'm back in factory to test

**Comment by namjaejeon** [comment]
Thanks!

**Comment by pesa1234** [comment]
[dump.pcapng.zip](https://github.com/cifsd-team/ksmbd/files/7707642/dump.pcapng.zip)
DONE! it is attached...

**Comment by pesa1234** [comment]
@namjaejeon Hi, did you have time to see the log and the new bug with XP?

Thanks and sorry to bother you...

**Comment by namjaejeon** [comment]
I have checked tcpdump. can't find any clue. So maybe, force to turn off signing feature in SMB1. I will send the patch to you soon.

**Comment by namjaejeon** [comment]
Regarding to text file issue, I don't have windows XP. So tested it using linux cifs client.

```
mount -t cifs //172.30.1.42/homes2 /mnt/test/ -o vers=1.0,username=linkinjeon,password=1234
root@linkinjeon-System-Product-Name:~# cd /mnt/test
root@linkinjeon-System-Product-Name:/mnt/test# ls
1.txt  aaaa
root@linkinjeon-System-Product-Name:/mnt/test# cat 1.txt 
0123456789012345678901234567890123456789
0123456789012345678901234567890123456789
```

Can you send tcpdump for this?

**Comment by namjaejeon** [comment]
For singing issue, Please check this patch(https://github.com/namjaejeon/ksmbd/commit/c5fcd819a9f93d62e0a12e5a5b3f9b195da20121)

**Comment by pesa1234** [comment]
Hi, tomorrow I try.
Do you have a plan for new version?

**Comment by namjaejeon** [comment]
```
int smb_read_andx(struct ksmbd_work *work)
..
        ksmbd_debug(SMB, "filename %pd, offset %lld, count %zu\n",
                    fp->filp->f_path.dentry, pos, count);
```
Can you share print log after change ksmbd_debug to pr_err ?

**Comment by pesa1234** [comment]
`smb1pdu.c:2928:9: error: expected ')' before 'SMB'
  pr_err(SMB, "filename %pd, offset %lld, count %zu\n",
         ^~~
`
```
--- a/smb1pdu.c
+++ b/smb1pdu.c
@@ -2925,7 +2925,7 @@ int smb_read_andx(struct ksmbd_work *wor
 		count = CIFS_DEFAULT_IOSIZE;
 	}
 
-	ksmbd_debug(SMB, "filename %pd, offset %lld, count %zu\n",
+	pr_err(SMB, "filename %pd, offset %lld, count %zu\n",
 		    fp->filp->f_path.dentry, pos, count);
 
 	work->aux_payload_buf = kvmalloc(count, GFP_KERNEL | __GFP_ZERO);


```

Why I'm wrong?

**Comment by namjaejeon** [comment]
Ah, please remove SMB. i.e. pr_err("filename %pd,

**Comment by pesa1234** [comment]
```
Sun Oct 24 09:03:41 2021 kern.err kernel: [  139.738289] ksmbd: filename txt.txt, offset 0, count 4096
Sun Oct 24 09:03:41 2021 kern.err kernel: [  139.745391] ksmbd: filename txt.txt, offset 61, count 4035

```

**Comment by namjaejeon** [comment]
Let me know your kernel version and local filesystem(ext4 ?)

**Comment by pesa1234** [comment]
Hi.
filesystem found with blkid is vfat
kernel is 5.4.154

**Comment by namjaejeon** [comment]
> For singing issue, Please check this patch(namjaejeon@c5fcd81)

Ping, have you checked this patch ?

**Comment by namjaejeon** [comment]
Can you add the below debug print log and show me the print log on your target ?

```
diff --git a/smb1pdu.c b/smb1pdu.c
index 53db488..0e815dd 100644
--- a/smb1pdu.c
+++ b/smb1pdu.c
@@ -122,6 +122,7 @@ int init_smb_rsp_hdr(struct ksmbd_work *work)
        /* remove 4 byte direct TCP header, add 1 byte wc and 2 byte bcc */
        rsp_hdr->smb_buf_length =
                cpu_to_be32(smb2_hdr_size_no_buflen(conn->vals) + 2);
+       pr_err("rsp_hdr->smb_buf_length : %u\n", be32_to_cpu(rsp_hdr->smb_buf_length));
        memcpy(rsp_hdr->Protocol, rcv_hdr->Protocol, 4);
        rsp_hdr->Command = rcv_hdr->Command;
```

**Comment by pesa1234** [comment]
Hi.
```
Sun Oct 24 09:03:49 2021 kern.err kernel: [  148.104246] ksmbd: rsp_hdr->smb_buf_length : 39
Sun Oct 24 09:03:49 2021 kern.err kernel: [  148.109197] ksmbd: filename start.log, offset 0, count 4096
Sun Oct 24 09:03:49 2021 kern.err kernel: [  148.117352] ksmbd: rsp_hdr->smb_buf_length : 39
Sun Oct 24 09:03:49 2021 kern.err kernel: [  148.124129] ksmbd: rsp_hdr->smb_buf_length : 39
Sun Oct 24 09:03:49 2021 kern.err kernel: [  148.129041] ksmbd: filename start.log, offset 29, count 4067
Sun Oct 24 09:03:49 2021 kern.err kernel: [  148.137070] ksmbd: rsp_hdr->smb_buf_length : 39
Sun Oct 24 09:03:49 2021 kern.err kernel: [  148.142010] ksmbd: rsp_hdr->smb_buf_length : 39
Sun Oct 24 09:03:49 2021 kern.err kernel: [  148.148841] ksmbd: rsp_hdr->smb_buf_length : 39
Sun Oct 24 09:03:49 2021 kern.err kernel: [  148.154605] ksmbd: rsp_hdr->smb_buf_length : 39
Sun Oct 24 09:03:49 2021 kern.err kernel: [  148.161422] ksmbd: rsp_hdr->smb_buf_length : 39
Sun Oct 24 09:03:49 2021 kern.err kernel: [  148.167861] ksmbd: rsp_hdr->smb_buf_length : 39
Sun Oct 24 09:03:49 2021 kern.err kernel: [  148.176636] ksmbd: rsp_hdr->smb_buf_length : 39

```

**Comment by namjaejeon** [comment]
Your target is big endian 32bit ?

**Comment by namjaejeon** [comment]
sizeof (struct smb_hdr) :
   1. my linux pc : 33
   2. your target : 37

Can not understand why sizeof size is different on two target. 
```
struct smb_hdr {
        __be32 smb_buf_length;
        __u8 Protocol[4];
        __u8 Command;
        union {
                struct {
                        __u8 ErrorClass;
                        __u8 Reserved;
                        __le16 Error;
                } __packed DosError;
                __le32 CifsError;
        } __packed Status;
        __u8 Flags;
        __le16 Flags2;          /* note: le */
        __le16 PidHigh;
        union {
                struct {
                        __le32 SequenceNumber;  /* le */
                        __u32 Reserved; /* zero */
                } __packed Sequence;
                __u8 SecuritySignature[8];      /* le */
        } __packed Signature;
        __u8 pad[2];
        __le16 Tid;
        __le16 Pid;
        __le16 Uid;
        __le16 Mid;
        __u8 WordCount;
} __packed;
```
Can you check how sizeof(struct smb_hdr) value is 37 on your target ?

**Comment by pesa1234** [comment]
> Your target is big endian 32bit ?

It's a mips24kc router with openwrt...

> Can you check how sizeof(struct smb_hdr) value is 37 on your target ?

How to check, sorry...

**Comment by namjaejeon** [comment]
You can print each size of type:
```
pr_err("sizeof(struct smb_hdr) : %lu, sizeof(__le16) : %lu, sizeof(__u8) : %lu, sizeof(__u32) : %lu, sizeof(__be32) : %lu, sizeof(rsp_hdr->Signature) : %lu, sizeof(rsp_hdr->Status) : %lu\n", sizeof(struct smb_hdr), sizeof(__le16), sizeof(__u8), sizeof(__u32), sizeof(__be32), sizeof(rsp_hdr->Signature), sizeof(rsp_hdr->Status));
```

**Comment by pesa1234** [comment]
Hi, this is the log...

`Sun Oct 24 09:03:38 2021 kern.err kernel: [  137.175294] ksmbd: sizeof(struct smb_hdr) : 37, sizeof(__le16) : 2, sizeof(__u8) : 1,sizeof(__u32) : 4, sizeof(__be32) : 4, sizeof(rsp_hdr->Signature) : 8, sizeof(rsp_hdr->Status) : 4
`

**Comment by namjaejeon** [comment]
can you send your ksmbd source to me ?

**Comment by namjaejeon** [comment]
smb1 signing failure issue is related to read data issue you reported.

**Comment by pesa1234** [comment]
> can you send your ksmbd source to me ?

[https://corghispa-my.sharepoint.com/:u:/g/personal/a_pesaresi_nexiongroup_com/ERd0wNqDd4FKuHDxTwRlKFgBG1q5Gz2wME5Q0EU_EbwBNw?e=hnoTWP](url)

How can we try to solve? How can I help? This bug is present in all OpenWRT router.

**Comment by namjaejeon** [comment]
I found root-cause. can you test the latest ksmbd in cifsd-team github ? you can check both signing issue and read issue on it.
If you confirm that your issues are clear, I will release 3.4.3 version ASAP.

**Comment by pesa1234** [comment]
I need to apply every patch, can you give me a package example 3.4.2.beta?

**Comment by namjaejeon** [comment]
Okay.
@neheb Hi, Rosen,  I have released ksmbd, ksmbd-tools 3.4.3 version, Please apply them to openWRT.

**Comment by namjaejeon** [comment]
@pesa1234 https://github.com/cifsd-team/ksmbd/releases/tag/3.4.3, https://github.com/cifsd-team/ksmbd-tools/releases/tag/3.4.3
Ah, package ? I don't know how to make it.
There are ksmbd-3.4.3.tgz and ksmbd-tools-3.4.3.tgz in release. If you can test it, you can download and test. If you can't, You may need to wait till Rosen apply this release to openWRT.

**Comment by pesa1234** [comment]
I was able to compile... I can not enter to shared folder. This is the log. 
And attached dump of tcpdump
[dump343.pcapng.zip](https://github.com/cifsd-team/ksmbd/files/7741115/dump343.pcapng.zip)

```
un Dec 19 15:54:06 2021 kern.info kernel: [ 1133.696253] ksmbd: client requested dialect PC NETWORK PROGRAM 1.0
Sun Dec 19 15:54:06 2021 kern.info kernel: [ 1133.702732] ksmbd: client requested dialect LANMAN1.0
Sun Dec 19 15:54:06 2021 kern.info kernel: [ 1133.708595] ksmbd: client requested dialect Windows for Workgroups 3.1a
Sun Dec 19 15:54:06 2021 kern.info kernel: [ 1133.715720] ksmbd: client requested dialect LM1.2X002
Sun Dec 19 15:54:06 2021 kern.info kernel: [ 1133.721059] ksmbd: client requested dialect LANMAN2.1
Sun Dec 19 15:54:06 2021 kern.info kernel: [ 1133.726506] ksmbd: client requested dialect NT LM 0.12
Sun Dec 19 15:54:06 2021 kern.info kernel: [ 1133.732234] ksmbd: client requested dialect PC NETWORK PROGRAM 1.0
Sun Dec 19 15:54:06 2021 kern.info kernel: [ 1133.738760] ksmbd: client requested dialect LANMAN1.0
Sun Dec 19 15:54:06 2021 kern.info kernel: [ 1133.744305] ksmbd: client requested dialect Windows for Workgroups 3.1a
Sun Dec 19 15:54:06 2021 kern.info kernel: [ 1133.751790] ksmbd: client requested dialect LM1.2X002
Sun Dec 19 15:54:06 2021 kern.info kernel: [ 1133.757238] ksmbd: client requested dialect LANMAN2.1
Sun Dec 19 15:54:06 2021 kern.info kernel: [ 1133.762584] ksmbd: client requested dialect NT LM 0.12
Sun Dec 19 15:54:06 2021 kern.info kernel: [ 1133.767986] ksmbd: client requested dialect PC NETWORK PROGRAM 1.0
Sun Dec 19 15:54:06 2021 kern.info kernel: [ 1133.774876] ksmbd: client requested dialect LANMAN1.0
Sun Dec 19 15:54:06 2021 kern.info kernel: [ 1133.780416] ksmbd: client requested dialect Windows for Workgroups 3.1a
Sun Dec 19 15:54:06 2021 kern.info kernel: [ 1133.787373] ksmbd: client requested dialect LM1.2X002
Sun Dec 19 15:54:06 2021 kern.info kernel: [ 1133.792802] ksmbd: client requested dialect LANMAN2.1
Sun Dec 19 15:54:06 2021 kern.info kernel: [ 1133.798158] ksmbd: client requested dialect NT LM 0.12
Sun Dec 19 15:54:06 2021 kern.info kernel: [ 1133.803565] ksmbd: selected NT LM 0.12 dialect
Sun Dec 19 15:54:06 2021 kern.info kernel: [ 1133.808256] ksmbd: conn->dialect 0x5
Sun Dec 19 15:54:06 2021 kern.info kernel: [ 1133.812046] ksmbd: spnego is on
Sun Dec 19 15:54:06 2021 kern.info kernel: [ 1133.844381] ksmbd: got SMB
Sun Dec 19 15:54:06 2021 kern.info kernel: [ 1133.847277] ksmbd: SMB2 byte count 177, struct size : 24
Sun Dec 19 15:54:06 2021 kern.info kernel: [ 1133.852789] ksmbd: SMB1 len 236
Sun Dec 19 15:54:06 2021 kern.info kernel: [ 1133.856042] ksmbd: New session ID: 1, Uid: 0
Sun Dec 19 15:54:06 2021 kern.info kernel: [ 1133.860473] ksmbd: build response with extend_security
Sun Dec 19 15:54:06 2021 kern.info kernel: [ 1133.865809] ksmbd: negotiate phase
Sun Dec 19 15:54:06 2021 kern.info kernel: [ 1133.874292] ksmbd: got SMB
Sun Dec 19 15:54:06 2021 kern.info kernel: [ 1133.877167] ksmbd: SMB2 byte count 205, struct size : 24
Sun Dec 19 15:54:06 2021 kern.info kernel: [ 1133.882676] ksmbd: SMB1 len 264
Sun Dec 19 15:54:06 2021 kern.info kernel: [ 1133.885954] ksmbd: Reuse session ID: 1, Uid: 1
Sun Dec 19 15:54:06 2021 kern.info kernel: [ 1133.890549] ksmbd: build response with extend_security
Sun Dec 19 15:54:06 2021 kern.info kernel: [ 1133.895900] ksmbd: authenticate phase
Sun Dec 19 15:54:06 2021 kern.info kernel: [ 1133.899709] ksmbd: session setup request for user
Sun Dec 19 15:54:06 2021 kern.info kernel: [ 1133.911045] ksmbd: NO tree connected
Sun Dec 19 15:54:06 2021 kern.info kernel: [ 1133.915742] ksmbd: NO tree connected
Sun Dec 19 15:54:06 2021 kern.info kernel: [ 1133.921738] ksmbd: got SMB
Sun Dec 19 15:54:06 2021 kern.info kernel: [ 1133.924823] ksmbd: SMB2 byte count 177, struct size : 24
Sun Dec 19 15:54:06 2021 kern.info kernel: [ 1133.930392] ksmbd: SMB1 len 236
Sun Dec 19 15:54:06 2021 kern.info kernel: [ 1133.933804] ksmbd: New session ID: 2, Uid: 0
Sun Dec 19 15:54:06 2021 kern.info kernel: [ 1133.938264] ksmbd: build response with extend_security
Sun Dec 19 15:54:06 2021 kern.info kernel: [ 1133.943598] ksmbd: negotiate phase
Sun Dec 19 15:54:06 2021 kern.info kernel: [ 1133.951547] ksmbd: got SMB
Sun Dec 19 15:54:06 2021 kern.info kernel: [ 1133.954576] ksmbd: SMB2 byte count 287, struct size : 24
Sun Dec 19 15:54:06 2021 kern.info kernel: [ 1133.960109] ksmbd: SMB1 len 346
Sun Dec 19 15:54:06 2021 kern.info kernel: [ 1133.963400] ksmbd: Reuse session ID: 2, Uid: 2
Sun Dec 19 15:54:06 2021 kern.info kernel: [ 1133.968001] ksmbd: build response with extend_security
Sun Dec 19 15:54:06 2021 kern.info kernel: [ 1133.973321] ksmbd: authenticate phase
Sun Dec 19 15:54:06 2021 kern.info kernel: [ 1133.977126] ksmbd: session setup request for user pesa
Sun Dec 19 15:54:06 2021 kern.info kernel: [ 1133.990932] ksmbd: NO tree connected
Sun Dec 19 15:54:06 2021 kern.info kernel: [ 1133.995650] ksmbd: NO tree connected

```

**Comment by namjaejeon** [comment]
Could you please try to check the below change ?

```
diff --git a/smb1pdu.c b/smb1pdu.c
index 55fda97..2ab431f 100644
--- a/smb1pdu.c
+++ b/smb1pdu.c
@@ -279,7 +279,7 @@ int smb_check_user_session(struct ksmbd_work *work)
 int smb_get_ksmbd_tcon(struct ksmbd_work *work)
 {
        struct smb_hdr *req_hdr = (struct smb_hdr *)work->request_buf;
-       unsigned int cmd = le16_to_cpu(req_hdr->Command);
+       u8 cmd = req_hdr->Command;
        int tree_id;
 
        work->tcon = NULL;
```

**Comment by namjaejeon** [comment]
@neheb I found more bugs in smb1. I will re-release 3.4.3 version after fixing it.

**Comment by pesa1234** [comment]
Hi, after this mod, I can access only if I modify the registry of windows by set the key enablesecuritysignature to 0.
And the file integrity is OK.
Otherwise it still ask for user and password also if I enable guest account...

This is the ksmbd log
```
Sun Oct 24 09:35:20 2021 kern.info kernel: [ 2039.215153] ksmbd: got SMB
Sun Oct 24 09:35:20 2021 kern.info kernel: [ 2039.218010] ksmbd: SMB2 byte count 98, struct size : 0
Sun Oct 24 09:35:20 2021 kern.info kernel: [ 2039.223365] ksmbd: SMB1 len 133
Sun Oct 24 09:35:20 2021 kern.info kernel: [ 2039.226621] ksmbd: client requested dialect PC NETWORK PROGRAM 1.0
Sun Oct 24 09:35:20 2021 kern.info kernel: [ 2039.233099] ksmbd: client requested dialect LANMAN1.0
Sun Oct 24 09:35:20 2021 kern.info kernel: [ 2039.238421] ksmbd: client requested dialect Windows for Workgroups 3.1a
Sun Oct 24 09:35:20 2021 kern.info kernel: [ 2039.245346] ksmbd: client requested dialect LM1.2X002
Sun Oct 24 09:35:20 2021 kern.info kernel: [ 2039.250665] ksmbd: client requested dialect LANMAN2.1
Sun Oct 24 09:35:20 2021 kern.info kernel: [ 2039.255980] ksmbd: client requested dialect NT LM 0.12
Sun Oct 24 09:35:20 2021 kern.info kernel: [ 2039.261380] ksmbd: client requested dialect PC NETWORK PROGRAM 1.0
Sun Oct 24 09:35:20 2021 kern.info kernel: [ 2039.267866] ksmbd: client requested dialect LANMAN1.0
Sun Oct 24 09:35:20 2021 kern.info kernel: [ 2039.273183] ksmbd: client requested dialect Windows for Workgroups 3.1a
Sun Oct 24 09:35:20 2021 kern.info kernel: [ 2039.280117] ksmbd: client requested dialect LM1.2X002
Sun Oct 24 09:35:20 2021 kern.info kernel: [ 2039.285431] ksmbd: client requested dialect LANMAN2.1
Sun Oct 24 09:35:20 2021 kern.info kernel: [ 2039.290750] ksmbd: client requested dialect NT LM 0.12
Sun Oct 24 09:35:20 2021 kern.info kernel: [ 2039.296156] ksmbd: client requested dialect PC NETWORK PROGRAM 1.0
Sun Oct 24 09:35:20 2021 kern.info kernel: [ 2039.302640] ksmbd: client requested dialect LANMAN1.0
Sun Oct 24 09:35:20 2021 kern.info kernel: [ 2039.307958] ksmbd: client requested dialect Windows for Workgroups 3.1a
Sun Oct 24 09:35:20 2021 kern.info kernel: [ 2039.315040] ksmbd: client requested dialect LM1.2X002
Sun Oct 24 09:35:20 2021 kern.info kernel: [ 2039.320407] ksmbd: client requested dialect LANMAN2.1
Sun Oct 24 09:35:20 2021 kern.info kernel: [ 2039.325725] ksmbd: client requested dialect NT LM 0.12
Sun Oct 24 09:35:20 2021 kern.info kernel: [ 2039.331137] ksmbd: selected NT LM 0.12 dialect
Sun Oct 24 09:35:20 2021 kern.info kernel: [ 2039.335822] ksmbd: conn->dialect 0x5
Sun Oct 24 09:35:20 2021 kern.info kernel: [ 2039.339537] ksmbd: spnego is on
Sun Oct 24 09:35:20 2021 kern.info kernel: [ 2039.372296] ksmbd: got SMB
Sun Oct 24 09:35:20 2021 kern.info kernel: [ 2039.375120] ksmbd: SMB2 byte count 177, struct size : 24
Sun Oct 24 09:35:20 2021 kern.info kernel: [ 2039.380654] ksmbd: SMB1 len 236
Sun Oct 24 09:35:20 2021 kern.info kernel: [ 2039.383914] ksmbd: New session ID: 1, Uid: 0
Sun Oct 24 09:35:20 2021 kern.info kernel: [ 2039.388325] ksmbd: build response with extend_security
Sun Oct 24 09:35:20 2021 kern.info kernel: [ 2039.393665] ksmbd: negotiate phase
Sun Oct 24 09:35:20 2021 kern.info kernel: [ 2039.404425] ksmbd: got SMB
Sun Oct 24 09:35:20 2021 kern.info kernel: [ 2039.407447] ksmbd: SMB2 byte count 205, struct size : 24
Sun Oct 24 09:35:20 2021 kern.info kernel: [ 2039.412952] ksmbd: SMB1 len 264
Sun Oct 24 09:35:20 2021 kern.info kernel: [ 2039.416374] ksmbd: Reuse session ID: 1, Uid: 1
Sun Oct 24 09:35:20 2021 kern.info kernel: [ 2039.421008] ksmbd: build response with extend_security
Sun Oct 24 09:35:20 2021 kern.info kernel: [ 2039.426353] ksmbd: authenticate phase
Sun Oct 24 09:35:20 2021 kern.info kernel: [ 2039.430161] ksmbd: session setup request for user
Sun Oct 24 09:35:21 2021 kern.info kernel: [ 2039.440650] ksmbd: skip to check tree connect request
Sun Oct 24 09:35:21 2021 kern.info kernel: [ 2039.445959] ksmbd: got SMB
Sun Oct 24 09:35:21 2021 kern.info kernel: [ 2039.448784] ksmbd: SMB2 byte count 47, struct size : 8
Sun Oct 24 09:35:21 2021 kern.info kernel: [ 2039.454105] ksmbd: SMB1 len 90
Sun Oct 24 09:35:21 2021 kern.info kernel: [ 2039.457286] ksmbd: bad smb1 sign
Sun Oct 24 09:35:21 2021 kern.info kernel: [ 2039.466443] ksmbd: skip to check tree connect request
Sun Oct 24 09:35:21 2021 kern.info kernel: [ 2039.471751] ksmbd: got SMB
Sun Oct 24 09:35:21 2021 kern.info kernel: [ 2039.474552] ksmbd: SMB2 byte count 0, struct size : 4
Sun Oct 24 09:35:21 2021 kern.info kernel: [ 2039.479799] ksmbd: SMB1 len 39
Sun Oct 24 09:35:21 2021 kern.info kernel: [ 2039.482983] ksmbd: bad smb1 sign
Sun Oct 24 09:35:21 2021 kern.info kernel: [ 2039.492897] ksmbd: got SMB
Sun Oct 24 09:35:21 2021 kern.info kernel: [ 2039.495773] ksmbd: SMB2 byte count 177, struct size : 24
Sun Oct 24 09:35:21 2021 kern.info kernel: [ 2039.501279] ksmbd: SMB1 len 236
Sun Oct 24 09:35:21 2021 kern.info kernel: [ 2039.504541] ksmbd: New session ID: 2, Uid: 0
Sun Oct 24 09:35:21 2021 kern.info kernel: [ 2039.508981] ksmbd: build response with extend_security
Sun Oct 24 09:35:21 2021 kern.info kernel: [ 2039.514312] ksmbd: negotiate phase
Sun Oct 24 09:35:21 2021 kern.info kernel: [ 2039.522311] ksmbd: got SMB
Sun Oct 24 09:35:21 2021 kern.info kernel: [ 2039.525375] ksmbd: SMB2 byte count 295, struct size : 24
Sun Oct 24 09:35:21 2021 kern.info kernel: [ 2039.530967] ksmbd: SMB1 len 354
Sun Oct 24 09:35:21 2021 kern.info kernel: [ 2039.534214] ksmbd: Reuse session ID: 2, Uid: 2
Sun Oct 24 09:35:21 2021 kern.info kernel: [ 2039.538816] ksmbd: build response with extend_security
Sun Oct 24 09:35:21 2021 kern.info kernel: [ 2039.544152] ksmbd: authenticate phase
Sun Oct 24 09:35:21 2021 kern.info kernel: [ 2039.547950] ksmbd: session setup request for user utente
Sun Oct 24 09:35:21 2021 kern.info kernel: [ 2039.558935] ksmbd: skip to check tree connect request
Sun Oct 24 09:35:21 2021 kern.info kernel: [ 2039.564185] ksmbd: got SMB
Sun Oct 24 09:35:21 2021 kern.info kernel: [ 2039.566998] ksmbd: SMB2 byte count 53, struct size : 8
Sun Oct 24 09:35:21 2021 kern.info kernel: [ 2039.572339] ksmbd: SMB1 len 96
Sun Oct 24 09:35:21 2021 kern.info kernel: [ 2039.575520] ksmbd: bad smb1 sign
Sun Oct 24 09:35:21 2021 kern.info kernel: [ 2039.582378] ksmbd: skip to check tree connect request
Sun Oct 24 09:35:21 2021 kern.info kernel: [ 2039.587809] ksmbd: got SMB
Sun Oct 24 09:35:21 2021 kern.info kernel: [ 2039.590611] ksmbd: SMB2 byte count 0, struct size : 4
Sun Oct 24 09:35:21 2021 kern.info kernel: [ 2039.595895] ksmbd: SMB1 len 39
Sun Oct 24 09:35:21 2021 kern.info kernel: [ 2039.599078] ksmbd: bad smb1 sign

```
One more thing, If I disable SMB1, seems same log...
```
Mon Dec 20 00:41:14 2021 kern.info kernel: [ 2860.869614] ksmbd: got SMB
Mon Dec 20 00:41:14 2021 kern.info kernel: [ 2860.872575] ksmbd: SMB2 byte count 98, struct size : 0
Mon Dec 20 00:41:14 2021 kern.info kernel: [ 2860.877968] ksmbd: SMB1 len 133
Mon Dec 20 00:41:14 2021 kern.info kernel: [ 2860.881210] ksmbd: client requested dialect PC NETWORK PROGRAM 1.0
Mon Dec 20 00:41:14 2021 kern.info kernel: [ 2860.887705] ksmbd: client requested dialect LANMAN1.0
Mon Dec 20 00:41:14 2021 kern.info kernel: [ 2860.893021] ksmbd: client requested dialect Windows for Workgroups 3.1a
Mon Dec 20 00:41:14 2021 kern.info kernel: [ 2860.899953] ksmbd: client requested dialect LM1.2X002
Mon Dec 20 00:41:14 2021 kern.info kernel: [ 2860.905268] ksmbd: client requested dialect LANMAN2.1
Mon Dec 20 00:41:14 2021 kern.info kernel: [ 2860.910595] ksmbd: client requested dialect NT LM 0.12
Mon Dec 20 00:41:14 2021 kern.info kernel: [ 2860.915993] ksmbd: client requested dialect PC NETWORK PROGRAM 1.0
Mon Dec 20 00:41:14 2021 kern.info kernel: [ 2860.922492] ksmbd: client requested dialect LANMAN1.0
Mon Dec 20 00:41:14 2021 kern.info kernel: [ 2860.927805] ksmbd: client requested dialect Windows for Workgroups 3.1a
Mon Dec 20 00:41:14 2021 kern.info kernel: [ 2860.934736] ksmbd: client requested dialect LM1.2X002
Mon Dec 20 00:41:14 2021 kern.info kernel: [ 2860.940051] ksmbd: client requested dialect LANMAN2.1
Mon Dec 20 00:41:14 2021 kern.info kernel: [ 2860.945362] ksmbd: client requested dialect NT LM 0.12
Mon Dec 20 00:41:14 2021 kern.info kernel: [ 2860.950778] ksmbd: client requested dialect PC NETWORK PROGRAM 1.0
Mon Dec 20 00:41:14 2021 kern.info kernel: [ 2860.957255] ksmbd: client requested dialect LANMAN1.0
Mon Dec 20 00:41:14 2021 kern.info kernel: [ 2860.962575] ksmbd: client requested dialect Windows for Workgroups 3.1a
Mon Dec 20 00:41:14 2021 kern.info kernel: [ 2860.969502] ksmbd: client requested dialect LM1.2X002
Mon Dec 20 00:41:14 2021 kern.info kernel: [ 2860.974938] ksmbd: client requested dialect LANMAN2.1
Mon Dec 20 00:41:14 2021 kern.info kernel: [ 2860.980298] ksmbd: client requested dialect NT LM 0.12
Mon Dec 20 00:41:14 2021 kern.info kernel: [ 2860.985714] ksmbd: selected NT LM 0.12 dialect
Mon Dec 20 00:41:14 2021 kern.info kernel: [ 2860.990397] ksmbd: conn->dialect 0x5
Mon Dec 20 00:41:14 2021 kern.info kernel: [ 2860.994098] ksmbd: spnego is on
Mon Dec 20 00:41:14 2021 kern.info kernel: [ 2861.026520] ksmbd: got SMB
Mon Dec 20 00:41:14 2021 kern.info kernel: [ 2861.029346] ksmbd: SMB2 byte count 177, struct size : 24
Mon Dec 20 00:41:14 2021 kern.info kernel: [ 2861.034851] ksmbd: SMB1 len 236
Mon Dec 20 00:41:14 2021 kern.info kernel: [ 2861.038141] ksmbd: New session ID: 1, Uid: 0
Mon Dec 20 00:41:14 2021 kern.info kernel: [ 2861.042564] ksmbd: build response with extend_security
Mon Dec 20 00:41:14 2021 kern.info kernel: [ 2861.047890] ksmbd: negotiate phase
Mon Dec 20 00:41:14 2021 kern.info kernel: [ 2861.055427] ksmbd: got SMB
Mon Dec 20 00:41:14 2021 kern.info kernel: [ 2861.058450] ksmbd: SMB2 byte count 205, struct size : 24
Mon Dec 20 00:41:14 2021 kern.info kernel: [ 2861.064008] ksmbd: SMB1 len 264
Mon Dec 20 00:41:14 2021 kern.info kernel: [ 2861.067269] ksmbd: Reuse session ID: 1, Uid: 1
Mon Dec 20 00:41:14 2021 kern.info kernel: [ 2861.071858] ksmbd: build response with extend_security
Mon Dec 20 00:41:14 2021 kern.info kernel: [ 2861.077364] ksmbd: authenticate phase
Mon Dec 20 00:41:14 2021 kern.info kernel: [ 2861.081181] ksmbd: session setup request for user
Mon Dec 20 00:41:14 2021 kern.info kernel: [ 2861.093028] ksmbd: skip to check tree connect request
Mon Dec 20 00:41:14 2021 kern.info kernel: [ 2861.098314] ksmbd: got SMB
Mon Dec 20 00:41:14 2021 kern.info kernel: [ 2861.101133] ksmbd: SMB2 byte count 47, struct size : 8
Mon Dec 20 00:41:14 2021 kern.info kernel: [ 2861.106463] ksmbd: SMB1 len 90
Mon Dec 20 00:41:14 2021 kern.info kernel: [ 2861.109648] ksmbd: bad smb1 sign
Mon Dec 20 00:41:14 2021 kern.info kernel: [ 2861.120120] ksmbd: skip to check tree connect request
Mon Dec 20 00:41:14 2021 kern.info kernel: [ 2861.125434] ksmbd: got SMB
Mon Dec 20 00:41:14 2021 kern.info kernel: [ 2861.128230] ksmbd: SMB2 byte count 0, struct size : 4
Mon Dec 20 00:41:14 2021 kern.info kernel: [ 2861.133471] ksmbd: SMB1 len 39
Mon Dec 20 00:41:14 2021 kern.info kernel: [ 2861.136639] ksmbd: bad smb1 sign
Mon Dec 20 00:41:14 2021 kern.info kernel: [ 2861.143862] ksmbd: got SMB
Mon Dec 20 00:41:14 2021 kern.info kernel: [ 2861.146883] ksmbd: SMB2 byte count 177, struct size : 24
Mon Dec 20 00:41:14 2021 kern.info kernel: [ 2861.152436] ksmbd: SMB1 len 236
Mon Dec 20 00:41:14 2021 kern.info kernel: [ 2861.155712] ksmbd: New session ID: 2, Uid: 0
Mon Dec 20 00:41:14 2021 kern.info kernel: [ 2861.160125] ksmbd: build response with extend_security
Mon Dec 20 00:41:14 2021 kern.info kernel: [ 2861.165491] ksmbd: negotiate phase
Mon Dec 20 00:41:14 2021 kern.info kernel: [ 2861.177748] ksmbd: got SMB
Mon Dec 20 00:41:14 2021 kern.info kernel: [ 2861.180561] ksmbd: SMB2 byte count 291, struct size : 24
Mon Dec 20 00:41:14 2021 kern.info kernel: [ 2861.186160] ksmbd: SMB1 len 350
Mon Dec 20 00:41:14 2021 kern.info kernel: [ 2861.189434] ksmbd: Reuse session ID: 2, Uid: 2
Mon Dec 20 00:41:14 2021 kern.info kernel: [ 2861.194031] ksmbd: build response with extend_security
Mon Dec 20 00:41:14 2021 kern.info kernel: [ 2861.199353] ksmbd: authenticate phase
Mon Dec 20 00:41:14 2021 kern.info kernel: [ 2861.203155] ksmbd: session setup request for user test
Mon Dec 20 00:41:14 2021 kern.info kernel: [ 2861.213864] ksmbd: skip to check tree connect request
Mon Dec 20 00:41:14 2021 kern.info kernel: [ 2861.219177] ksmbd: got SMB
Mon Dec 20 00:41:14 2021 kern.info kernel: [ 2861.221991] ksmbd: SMB2 byte count 53, struct size : 8
Mon Dec 20 00:41:14 2021 kern.info kernel: [ 2861.227323] ksmbd: SMB1 len 96
Mon Dec 20 00:41:14 2021 kern.info kernel: [ 2861.230519] ksmbd: bad smb1 sign
Mon Dec 20 00:41:14 2021 kern.info kernel: [ 2861.237646] ksmbd: skip to check tree connect request
Mon Dec 20 00:41:14 2021 kern.info kernel: [ 2861.242946] ksmbd: got SMB
Mon Dec 20 00:41:14 2021 kern.info kernel: [ 2861.245767] ksmbd: SMB2 byte count 0, struct size : 4
Mon Dec 20 00:41:14 2021 kern.info kernel: [ 2861.250988] ksmbd: SMB1 len 39
Mon Dec 20 00:41:14 2021 kern.info kernel: [ 2861.254182] ksmbd: bad smb1 sign


```

**Comment by namjaejeon** [comment]
Thanks for your test!

Please try this patch. and let me know windows XP behavior.
```
diff --git a/smb1pdu.c b/smb1pdu.c
index 14cc5b9..d1107c7 100644
--- a/smb1pdu.c
+++ b/smb1pdu.c
@@ -8418,12 +8418,21 @@ out:
  */
 bool smb1_is_sign_req(struct ksmbd_work *work, unsigned int command)
 {
+#if 0
        struct smb_hdr *rcv_hdr1 = (struct smb_hdr *)work->request_buf;

+       /*
+        * FIXME: signed tree connect failed by signing error
+        * with windows XP client. For now, Force to turn off
+        * signing feature in SMB1.
+        */
        if ((rcv_hdr1->Flags2 & SMBFLG2_SECURITY_SIGNATURE) &&
                        command != SMB_COM_SESSION_SETUP_ANDX)
                return true;
        return false;
+#else
+       return false;
+#endif
 }
```

**Comment by pesa1234** [comment]
Yep! It works!
it is not necessary to set...
```
server min protocol = NT1
server signing = disabled
```
Is it right?
Works also without SMB1-legacy!

**Comment by namjaejeon** [comment]
Okay, I will release 3.4.3 today. thanks for your test:)

**Comment by pesa1234** [comment]
Thanks a lot for your great module! It's very good in a low-end devices! So, it's what I need!

**Comment by namjaejeon** [comment]
Ah, if you set "server signing = disabled" in smb.conf, it work fine with windows XP that enable smb1 signing ?

**Comment by pesa1234** [comment]
Hi, with settings `server signing = disabled` and no this patch it doesn't works

```
diff --git a/smb1pdu.c b/smb1pdu.c
index 14cc5b9..d1107c7 100644
--- a/smb1pdu.c
+++ b/smb1pdu.c
@@ -8418,12 +8418,21 @@ out:
  */
 bool smb1_is_sign_req(struct ksmbd_work *work, unsigned int command)
 {
+#if 0
        struct smb_hdr *rcv_hdr1 = (struct smb_hdr *)work->request_buf;

+       /*
+        * FIXME: signed tree connect failed by signing error
+        * with windows XP client. For now, Force to turn off
+        * signing feature in SMB1.
+        */
        if ((rcv_hdr1->Flags2 & SMBFLG2_SECURITY_SIGNATURE) &&
                        command != SMB_COM_SESSION_SETUP_ANDX)
                return true;
        return false;
+#else
+       return false;
+#endif
 }
```

**Comment by namjaejeon** [comment]
@pesa1234 Ok, I have released. Thanks!
@neheb Hi Rosen, ksmbd/ksmbd-tools 3.4.3 version are ready. Please check them. Thanks!

**Comment by pesa1234** [comment]
Just for info...
Compiled for mips_24kc and for arm_cortex‑a9 works ok also for XP users...

**Comment by namjaejeon** [comment]
Great! Thanks for your checking!

**Comment by neheb** [comment]
@namjaejeon small note, the ksmbd tarball contains a git archive. I doubt that's needed.

**Comment by namjaejeon** [comment]
@neheb Done! Thanks!

**Comment by neheb** [comment]
Somewhat related: https://github.com/openwrt/openwrt/pull/4866

@pesa1234 you mentioned old machines. ReactOS might be better than XP there.

**Comment by namjaejeon** [comment]
@pesa1234 Close ?

**Comment by pesa1234** [comment]
YES, thanks
